Intervention,Description,Parameter,Name,Units,Example1,Example2Fertility control in donor,per capita birth rate (donor),$\mu_d$,birth_d,1/day,0.000182523,0.000182523,per capita birth rate (recipient),$\mu_r$,birth_r,1/day,4.56308E-05,4.56308E-05Culling of donor,per capita mortality rate (donor),$\delta_d$,mort_d,1/day,0.000182523,0.000182523,per capita mortality rate (recipient),$\delta_r$,mort_r,1/day,4.56308E-05,4.56308E-05Food distribution or movement restriction for donor,contact hazard among donors,$\alpha_{d-d}$,cont_dd,1/day,1.91441E-05,0.00361683Behavior modificaiton of recipient,contact hazard among recipients,$\alpha_{r-r}$,cont_rr,1/day,0.001193543,0.001104257Biosecurity measures at the interface,contact hazard of recipeint with donors,$\alpha_{d-r}$,cont_dr,1/day,0.000777828,0.000228754Vaccination in donor ,per contact transmission probability in donor,$\rho_{d-d}$,trans_dd,,0.01,0.01Vaccination in recipient,per contact transmission probability in recipient,$\rho_{r-r}$,trans_rr,,0.01,0.01Vaccination in recipient,per contact transmission probability (donor to recipeint),$\rho_{d-r}$,trans_dr,,0.01,0.01,$R_0$ (donor to donor),$R_{0_{d-d}}$,R0_dd,,1.23,4.25,$R_0$ (donor to recipient),$R_{0_{d-r}}$,R0_dr,,0.5,0.275,$R_0$ (recipient to recipient),$R_{0_{r-r}}$,R0_rr,,1.9,0.55Treatment of donor,duration of infection (donor),$D_d = 1/\gamma_d$,dur_d,days,730,12Treatment of recipient,duration of infection (recipient),$D_r = 1/\gamma_r$,dur_r,days,16,5,per capita vaccination hazard (donor),$\nu_d$,vax_d,1/day,0,0,per capita vaccination hazard (recipient),$\nu_r$,vax_r,1/day,0,0,initial population size (donor),$N_{0_d}$,pop0_d,individuals,10000,10000,initial population size (recipient),$N_{0_r}$,pop0_r,individuals,10000,10000